{
  "schema_contrato_modulo": 1,
  "versao_contrato": "1.0.0",
  "module_id": "rules_and_character_state",
  "unidade_contexto_legada": "evento",
  "indicadores": {
    "rolagens_com_cd_previa": {
      "unidade_avaliativa": "atividade_modular",
      "medida": "proporcao",
      "fonte": "adjudicacao_ou_recibo_objetivo",
      "denominador": "unidades elegíveis com evidência completa; indeterminadas excluídas e contadas separadamente",
      "ausencia_de_evidencia": "indeterminado; nunca zero, sucesso ou inaplicabilidade presumidos"
    },
    "integridade_resultado_consequencia": {
      "unidade_avaliativa": "atividade_modular",
      "medida": "proporcao",
      "fonte": "adjudicacao_ou_recibo_objetivo",
      "denominador": "unidades elegíveis com evidência completa; indeterminadas excluídas e contadas separadamente",
      "ausencia_de_evidencia": "indeterminado; nunca zero, sucesso ou inaplicabilidade presumidos"
    },
    "consultas_regra_por_oportunidade": {
      "unidade_avaliativa": "oportunidade",
      "medida": "contagem",
      "fonte": "observacao",
      "denominador": null,
      "ausencia_de_evidencia": "indeterminado; nunca zero, sucesso ou inaplicabilidade presumidos"
    },
    "redescobertas_schema_cli": {
      "unidade_avaliativa": "operacao_executada",
      "medida": "contagem",
      "fonte": "observacao",
      "denominador": null,
      "ausencia_de_evidencia": "indeterminado; nunca zero, sucesso ou inaplicabilidade presumidos"
    },
    "recursos_comprometidos_aplicados": {
      "unidade_avaliativa": "atividade_modular",
      "medida": "proporcao",
      "fonte": "adjudicacao_ou_recibo_objetivo",
      "denominador": "unidades elegíveis com evidência completa; indeterminadas excluídas e contadas separadamente",
      "ausencia_de_evidencia": "indeterminado; nunca zero, sucesso ou inaplicabilidade presumidos"
    },
    "deltas_persistentes_validos": {
      "unidade_avaliativa": "atividade_modular",
      "medida": "proporcao",
      "fonte": "adjudicacao_ou_recibo_objetivo",
      "denominador": "unidades elegíveis com evidência completa; indeterminadas excluídas e contadas separadamente",
      "ausencia_de_evidencia": "indeterminado; nunca zero, sucesso ou inaplicabilidade presumidos"
    },
    "divergencias_ficha_estado_runtime": {
      "unidade_avaliativa": "atividade_modular",
      "medida": "contagem",
      "fonte": "observacao",
      "denominador": null,
      "ausencia_de_evidencia": "indeterminado; nunca zero, sucesso ou inaplicabilidade presumidos"
    },
    "instantes_canonicos_coerentes": {
      "unidade_avaliativa": "atividade_modular",
      "medida": "proporcao",
      "fonte": "adjudicacao_ou_recibo_objetivo",
      "denominador": "unidades elegíveis com evidência completa; indeterminadas excluídas e contadas separadamente",
      "ausencia_de_evidencia": "indeterminado; nunca zero, sucesso ou inaplicabilidade presumidos"
    },
    "correcoes_mecanicas_jogador": {
      "unidade_avaliativa": "manifestacao",
      "medida": "contagem",
      "fonte": "observacao",
      "denominador": null,
      "ausencia_de_evidencia": "indeterminado; nunca zero, sucesso ou inaplicabilidade presumidos"
    }
  }
}
