{
  "schema_contrato_modulo": 1,
  "versao_contrato": "1.0.0",
  "module_id": "canonical_quest_integration",
  "unidade_contexto_legada": "evento",
  "indicadores": {
    "cobertura_recibos_por_atividade": {
      "unidade_avaliativa": "atividade_modular",
      "medida": "proporcao",
      "fonte": "adjudicacao_ou_recibo_objetivo",
      "denominador": "unidades elegíveis com evidência completa; indeterminadas excluídas e contadas separadamente",
      "ausencia_de_evidencia": "indeterminado; nunca zero, sucesso ou inaplicabilidade presumidos"
    },
    "acuracia_balanceada_integracao": {
      "unidade_avaliativa": "oportunidade",
      "medida": "percentual",
      "fonte": "observacao",
      "denominador": "unidades elegíveis com evidência completa; indeterminadas excluídas e contadas separadamente",
      "ausencia_de_evidencia": "indeterminado; nunca zero, sucesso ou inaplicabilidade presumidos"
    },
    "pontes_com_evidencia": {
      "unidade_avaliativa": "atividade_modular",
      "medida": "proporcao",
      "fonte": "adjudicacao_ou_recibo_objetivo",
      "denominador": "unidades elegíveis com evidência completa; indeterminadas excluídas e contadas separadamente",
      "ausencia_de_evidencia": "indeterminado; nunca zero, sucesso ou inaplicabilidade presumidos"
    },
    "hipoteses_promovidas": {
      "unidade_avaliativa": "atividade_modular",
      "medida": "contagem",
      "fonte": "observacao",
      "denominador": null,
      "ausencia_de_evidencia": "indeterminado; nunca zero, sucesso ou inaplicabilidade presumidos"
    },
    "vazamentos_canonicos": {
      "unidade_avaliativa": "atividade_modular",
      "medida": "contagem",
      "fonte": "observacao",
      "denominador": null,
      "ausencia_de_evidencia": "indeterminado; nunca zero, sucesso ou inaplicabilidade presumidos"
    }
  }
}
