{
  "schema_contrato_modulo": 1,
  "versao_contrato": "1.0.0",
  "module_id": "adversarial_operations",
  "unidade_contexto_legada": "evento",
  "indicadores": {
    "operacoes_pre_comprometidas": {
      "unidade_avaliativa": "atividade_modular",
      "medida": "proporcao",
      "fonte": "adjudicacao_ou_recibo_objetivo",
      "denominador": "unidades elegíveis com evidência completa; indeterminadas excluídas e contadas separadamente",
      "ausencia_de_evidencia": "indeterminado; nunca zero, sucesso ou inaplicabilidade presumidos"
    },
    "recursos_duplicados_entre_frentes": {
      "unidade_avaliativa": "atividade_modular",
      "medida": "contagem",
      "fonte": "observacao",
      "denominador": null,
      "ausencia_de_evidencia": "indeterminado; nunca zero, sucesso ou inaplicabilidade presumidos"
    },
    "capacidades_ou_conhecimento_fabricados": {
      "unidade_avaliativa": "atividade_modular",
      "medida": "contagem",
      "fonte": "observacao",
      "denominador": null,
      "ausencia_de_evidencia": "indeterminado; nunca zero, sucesso ou inaplicabilidade presumidos"
    }
  }
}
