{
  "schema_contrato_modulo": 1,
  "versao_contrato": "1.0.0",
  "module_id": "world_boundary_resolution",
  "unidade_contexto_legada": "fronteira",
  "indicadores": {
    "causas_vencidas_cobertas": {
      "unidade_avaliativa": "atividade_modular",
      "medida": "proporcao",
      "fonte": "adjudicacao_ou_recibo_objetivo",
      "denominador": "unidades elegíveis com evidência completa; indeterminadas excluídas e contadas separadamente",
      "ausencia_de_evidencia": "indeterminado; nunca zero, sucesso ou inaplicabilidade presumidos"
    },
    "eventos_canonicos_noop": {
      "unidade_avaliativa": "atividade_modular",
      "medida": "contagem",
      "fonte": "observacao",
      "denominador": null,
      "ausencia_de_evidencia": "indeterminado; nunca zero, sucesso ou inaplicabilidade presumidos"
    },
    "tempo_de_resolucao": {
      "unidade_avaliativa": "fronteira",
      "medida": "segundos",
      "fonte": "observacao",
      "denominador": null,
      "ausencia_de_evidencia": "indeterminado; nunca zero, sucesso ou inaplicabilidade presumidos"
    }
  }
}
