{
  "schema_contrato_modulo": 1,
  "versao_contrato": "1.0.0",
  "module_id": "npc_continuity_and_social_behavior",
  "unidade_contexto_legada": "cena",
  "indicadores": {
    "iniciativas_com_presenca_ou_contato": {
      "unidade_avaliativa": "atividade_modular",
      "medida": "proporcao",
      "fonte": "adjudicacao_ou_recibo_objetivo",
      "denominador": "unidades elegíveis com evidência completa; indeterminadas excluídas e contadas separadamente",
      "ausencia_de_evidencia": "indeterminado; nunca zero, sucesso ou inaplicabilidade presumidos"
    },
    "aberturas_repetidas_por_janela": {
      "unidade_avaliativa": "janela",
      "medida": "contagem",
      "fonte": "observacao",
      "denominador": null,
      "ausencia_de_evidencia": "indeterminado; nunca zero, sucesso ou inaplicabilidade presumidos"
    },
    "contradicoes_de_identidade_ou_memoria": {
      "unidade_avaliativa": "atividade_modular",
      "medida": "contagem",
      "fonte": "observacao",
      "denominador": null,
      "ausencia_de_evidencia": "indeterminado; nunca zero, sucesso ou inaplicabilidade presumidos"
    },
    "fatos_sociais_persistidos_com_evidencia": {
      "unidade_avaliativa": "fato_memoria",
      "medida": "proporcao",
      "fonte": "adjudicacao_ou_recibo_objetivo",
      "denominador": "unidades elegíveis com evidência completa; indeterminadas excluídas e contadas separadamente",
      "ausencia_de_evidencia": "indeterminado; nunca zero, sucesso ou inaplicabilidade presumidos"
    },
    "rendimento_visivel_por_ativacao": {
      "unidade_avaliativa": "atividade_modular",
      "medida": "proporcao",
      "fonte": "adjudicacao_ou_recibo_objetivo",
      "denominador": "unidades elegíveis com evidência completa; indeterminadas excluídas e contadas separadamente",
      "ausencia_de_evidencia": "indeterminado; nunca zero, sucesso ou inaplicabilidade presumidos"
    }
  }
}
